{
  "schemaVersion": "1.0.0",
  "meta": {
    "title": "Collegium Cortex Implantation Status",
    "surface": "Cortex Praetorium",
    "reason": "Superficie executiva de supervisao da implantacao do Collegium com leitura curta para Chairman e lider de desenvolvimento.",
    "notThis": "Nao e dashboard SaaS generico, nao e runtime engine e nao e painel de tooling LAB.",
    "statusSignal": "consolidacao ativa com base operacional real no LAB.",
    "lastUpdated": "2026-03-16T15:59:59.577Z",
    "scope": {
      "covers": [
        "Implantacao atual do Collegium Cortex dentro de c:\\Pico-Open\\openclaw-push.",
        "Leitura executiva da frente ativa, dos bloqueios, das decisoes pendentes e das evidencias recentes.",
        "Separacao entre base OpenClaw Runtime, superficies do produto, integracoes PEMA e tooling de LAB.",
        "Topologia operacional entre local, VPS prod, VPS lab e PicoClaw."
      ],
      "doesNotCover": [
        "O workspace inteiro de c:\\Pico-Open.",
        "Roadmap institucional completo do protocolo.",
        "Planejamento detalhado de sprint ou inventario tecnico exaustivo."
      ],
      "distinction": [
        "OpenClaw Runtime: engine, gateway, sessoes, pairing, auth, cron, agentes e infraestrutura.",
        "Collegium Cortex: superficies de produto e de leitura executiva usadas para operar, deliberar e supervisionar.",
        "Cadencia: atualizacao por evento + fechamento diario + revisao semanal."
      ]
    }
  },
  "generalState": {
    "branch": "antigravity-dev",
    "activeFront": "consolidacao das superficies do Collegium com guardrails, contexto agentic e leitura executiva local.",
    "overallStatus": "consolidacao ativa com base operacional real no LAB.",
    "lastCheckpoint": "2026-03-11",
    "agenticContract": "baseline explicita de mandato, explicabilidade, escalation e HITL agora existe no repo."
  },
  "summarySignals": [
    {
      "label": "branch ativa",
      "value": "antigravity-dev",
      "status": "ativo",
      "summary": "Branch viva da implantacao em acompanhamento executivo."
    },
    {
      "label": "gateway local",
      "value": "ok",
      "status": "ativo",
      "summary": "Health direto do runtime local validado em 127.0.0.1:19000."
    },
    {
      "label": "chairman api",
      "value": "ok",
      "status": "ativo",
      "summary": "Health do Chairman API sondado; leitura de /state nao disponivel ou nao autenticada."
    },
    {
      "label": "status geral",
      "value": "consolidacao ativa com base operacional real no LAB.",
      "status": "consolidacao ativa com base operacional real no LAB.",
      "summary": "Leitura dominante da implantacao no ciclo atual."
    },
    {
      "label": "superficies ativas",
      "value": "1",
      "status": "ativo",
      "summary": "Superficies com sinal forte na implantacao atual."
    },
    {
      "label": "bloqueios ativos",
      "value": "3",
      "status": "bloqueado",
      "summary": "3 decisoes pendentes e 3 componentes lab/provisorios na leitura atual."
    }
  ],
  "now": [
    {
      "id": "now-01",
      "title": "Consolidando uma camada executiva local para acompanhar a implantacao sem depender do chat.",
      "summary": "Consolidando uma camada executiva local para acompanhar a implantacao sem depender do chat.",
      "lastUpdated": "2026-03-16"
    },
    {
      "id": "now-02",
      "title": "Cortex Command, The Forum e Cortex Praetorium ja existem na UI e precisam de uma leitura operacional mais curta.",
      "summary": "Cortex Command, The Forum e Cortex Praetorium ja existem na UI e precisam de uma leitura operacional mais curta.",
      "lastUpdated": "2026-03-16"
    },
    {
      "id": "now-03",
      "title": "Chairman API, handoff com HMAC + TTL e cluster_write_guard sustentam o LAB.",
      "summary": "Chairman API, handoff com HMAC + TTL e cluster_write_guard sustentam o LAB.",
      "lastUpdated": "2026-03-16"
    },
    {
      "id": "now-04",
      "title": "O runtime local permanece em 2026.2.6-3 por decisao deliberada de risco.",
      "summary": "O runtime local permanece em 2026.2.6-3 por decisao deliberada de risco.",
      "lastUpdated": "2026-03-16"
    },
    {
      "id": "now-05",
      "title": "A ambiguidade local entre o container Docker legado e o runtime canonico do repo atual foi removida; 19000 agora pertence ao openclaw-push.",
      "summary": "A ambiguidade local entre o container Docker legado e o runtime canonico do repo atual foi removida; 19000 agora pertence ao openclaw-push.",
      "lastUpdated": "2026-03-16"
    },
    {
      "id": "now-06",
      "title": "A politica operacional agora esta formalizada: codigo nasce no local, validacao real de runtime fecha em VPS lab e prod fica restrito a operacao estavel.",
      "summary": "A politica operacional agora esta formalizada: codigo nasce no local, validacao real de runtime fecha em VPS lab e prod fica restrito a operacao estavel.",
      "lastUpdated": "2026-03-16"
    },
    {
      "id": "now-07",
      "title": "A VPS nao e um bloco unico: hoje ela abriga prod, lab e picoclaw, cada um com ciclo de mudanca e diagnostico proprio.",
      "summary": "A VPS nao e um bloco unico: hoje ela abriga prod, lab e picoclaw, cada um com ciclo de mudanca e diagnostico proprio.",
      "lastUpdated": "2026-03-16"
    },
    {
      "id": "now-08",
      "title": "prod e lab agora usam checkouts remotos dedicados na VPS, reduzindo drift entre validacao e release.",
      "summary": "prod e lab agora usam checkouts remotos dedicados na VPS, reduzindo drift entre validacao e release.",
      "lastUpdated": "2026-03-16"
    },
    {
      "id": "now-09",
      "title": "A higiene recorrente do motor agora roda em modo read-only por padrao; despacho CLI exige opt-in explicito.",
      "summary": "A higiene recorrente do motor agora roda em modo read-only por padrao; despacho CLI exige opt-in explicito.",
      "lastUpdated": "2026-03-16"
    },
    {
      "id": "now-10",
      "title": "O gate operacional de lab agora tem um preflight curto e read-only, com health, tunel local e Control UI em um unico comando.",
      "summary": "O gate operacional de lab agora tem um preflight curto e read-only, com health, tunel local e Control UI em um unico comando.",
      "lastUpdated": "2026-03-16"
    },
    {
      "id": "now-11",
      "title": "O gate operacional de prod agora tem o preflight espelhado em modo read-only, pronto para entrar na promocao canônica.",
      "summary": "O gate operacional de prod agora tem o preflight espelhado em modo read-only, pronto para entrar na promocao canônica.",
      "lastUpdated": "2026-03-16"
    },
    {
      "id": "now-12",
      "title": "O pacote Collegium agora tem verificacao local unica via pnpm collegium:verify, incluindo evals deterministicas de governanca agentica.",
      "summary": "O pacote Collegium agora tem verificacao local unica via pnpm collegium:verify, incluindo evals deterministicas de governanca agentica.",
      "lastUpdated": "2026-03-16"
    },
    {
      "id": "now-13",
      "title": "The Forum agora renderiza uma sala deliberativa com DecisionTrace, evidencias, opcao recomendada e chairmanAction explicita.",
      "summary": "The Forum agora renderiza uma sala deliberativa com DecisionTrace, evidencias, opcao recomendada e chairmanAction explicita.",
      "lastUpdated": "2026-03-16"
    },
    {
      "id": "now-14",
      "title": "RuntimeSignals agora concentram continuidade de runtime, pressao de autoridade, cadencia de automacao, continuidade de sessao e ambiguidade estrategica.",
      "summary": "RuntimeSignals agora concentram continuidade de runtime, pressao de autoridade, cadencia de automacao, continuidade de sessao e ambiguidade estrategica.",
      "lastUpdated": "2026-03-16"
    },
    {
      "id": "now-15",
      "title": "The Cockpit agora existe como contrato, arquitetura e preview interno separados de Cortex Praetorium, sem abrir build amplo do produto do piloto nesta fase.",
      "summary": "The Cockpit agora existe como contrato, arquitetura e preview interno separados de Cortex Praetorium, sem abrir build amplo do produto do piloto nesta fase.",
      "lastUpdated": "2026-03-16"
    },
    {
      "id": "now-16",
      "title": "Outro chat no mesmo workspace agora esta explicitamente enquadrado: so pode operar como frente",
      "summary": "Outro chat no mesmo workspace agora esta explicitamente enquadrado: so pode operar como frente",
      "lastUpdated": "2026-03-16"
    },
    {
      "id": "now-17",
      "title": "O foco imediato e reduzir ambiguidade entre produto, bastidor tecnico e tooling de desenvolvimento.",
      "summary": "O foco imediato e reduzir ambiguidade entre produto, bastidor tecnico e tooling de desenvolvimento.",
      "lastUpdated": "2026-03-16"
    }
  ],
  "nextDominantAction": {
    "id": "next-01",
    "title": "Usar este painel como checkpoint unico da implantacao do Collegium, manter a higiene recorrente em read-only e promover qualquer mudanca de runtime pelo trilho local -> VPS lab -> VPS prod.",
    "summary": "Acao dominante da leitura executiva atual do Collegium.",
    "lastUpdated": "2026-03-16"
  },
  "weeklyTop3": [
    {
      "id": "top-01",
      "title": "Consolidar a leitura executiva diaria da implantacao do Collegium.",
      "summary": "Consolidar a leitura executiva diaria da implantacao do Collegium.",
      "lastUpdated": "2026-03-16"
    },
    {
      "id": "top-02",
      "title": "Reduzir dependencia de snapshots intermediarios nas superficies de produto.",
      "summary": "Reduzir dependencia de snapshots intermediarios nas superficies de produto.",
      "lastUpdated": "2026-03-16"
    },
    {
      "id": "top-03",
      "title": "Preparar a janela limpa que permitira abrir a trilha isolada de upgrade para 2026.3.8.",
      "summary": "Preparar a janela limpa que permitira abrir a trilha isolada de upgrade para 2026.3.8.",